{
  "vendor": "Asana",
  "domain": "asana.com",
  "updatedAt": "2026-06-21",
  "controls": {
    "sso": { "verdict": "supported", "confidence": 0.75, "standards": ["SAML 2.0"], "summary": "SAML SSO on the Enterprise tier.", "citations": [{ "title": "Asana Guide", "url": "https://asana.com/guide" }, { "title": "The SSO Wall of Shame", "url": "https://sso.tax/" }], "source": "seed" },
    "ulm": { "verdict": "supported", "confidence": 0.7, "standards": ["SCIM 2.0"], "summary": "SCIM provisioning on Enterprise.", "citations": [{ "title": "Asana Guide", "url": "https://asana.com/guide" }], "source": "seed" },
    "entitlements": { "verdict": "partial", "confidence": 0.45, "standards": ["SCIM groups"], "summary": "Team/role assignment via SCIM; project permissions in-product.", "citations": [{ "title": "Asana Guide", "url": "https://asana.com/guide" }], "source": "seed" },
    "riskSignals": { "verdict": "unknown", "confidence": 0.3, "standards": [], "summary": "No documented CAEP/SSF support.", "citations": [], "source": "seed" },
    "logout": { "verdict": "partial", "confidence": 0.4, "standards": ["Session management"], "summary": "Admin session controls; SLO not documented.", "citations": [{ "title": "Asana Guide", "url": "https://asana.com/guide" }], "source": "seed" },
    "tokenRevocation": { "verdict": "partial", "confidence": 0.4, "standards": ["OAuth 2.0"], "summary": "OAuth app management; token revocation for connected apps.", "citations": [{ "title": "Asana Guide", "url": "https://asana.com/guide" }], "source": "seed" }
  }
}
