{
  "vendor": "Figma",
  "domain": "figma.com",
  "updatedAt": "2026-06-21",
  "controls": {
    "sso": {
      "verdict": "supported",
      "confidence": 0.75,
      "standards": ["SAML 2.0"],
      "summary": "SAML SSO on Organization and Enterprise plans.",
      "citations": [{ "title": "Figma Help Center", "url": "https://help.figma.com" }, { "title": "The SSO Wall of Shame", "url": "https://sso.tax/" }],
      "source": "seed"
    },
    "ulm": {
      "verdict": "supported",
      "confidence": 0.7,
      "standards": ["SCIM 2.0"],
      "summary": "SCIM provisioning on Enterprise plans.",
      "citations": [{ "title": "Figma Help Center", "url": "https://help.figma.com" }],
      "source": "seed"
    },
    "entitlements": {
      "verdict": "partial",
      "confidence": 0.45,
      "standards": ["SCIM groups"],
      "summary": "Group/role assignment via SCIM; project permissions in-product.",
      "citations": [{ "title": "Figma Help Center", "url": "https://help.figma.com" }],
      "source": "seed"
    },
    "riskSignals": { "verdict": "unknown", "confidence": 0.3, "standards": [], "summary": "No documented CAEP/SSF support.", "citations": [], "source": "seed" },
    "logout": { "verdict": "partial", "confidence": 0.4, "standards": ["Session management"], "summary": "Admin session revocation; SLO not documented.", "citations": [{ "title": "Figma Help Center", "url": "https://help.figma.com" }], "source": "seed" },
    "tokenRevocation": { "verdict": "partial", "confidence": 0.4, "standards": ["OAuth 2.0"], "summary": "OAuth app token management; personal access tokens revocable.", "citations": [{ "title": "Figma Help Center", "url": "https://help.figma.com" }], "source": "seed" }
  }
}
