{
  "vendor": "GitHub",
  "domain": "github.com",
  "updatedAt": "2026-06-21",
  "controls": {
    "sso": {
      "verdict": "supported",
      "confidence": 0.9,
      "standards": ["SAML 2.0", "OIDC"],
      "summary": "SAML SSO for Organizations and Enterprise Cloud; OIDC for Enterprise Managed Users. Enterprise-tier feature.",
      "citations": [
        { "title": "GitHub Docs — Identity and access management", "url": "https://docs.github.com" },
        { "title": "The SSO Wall of Shame", "url": "https://sso.tax/" }
      ],
      "source": "human",
      "verifiedBy": "seed-maintainer",
      "verifiedAt": "2026-06-21"
    },
    "ulm": {
      "verdict": "supported",
      "confidence": 0.85,
      "standards": ["SCIM 2.0"],
      "summary": "SCIM provisioning/deprovisioning for Enterprise Managed Users and SAML-enabled orgs.",
      "citations": [{ "title": "GitHub Docs — SCIM", "url": "https://docs.github.com" }],
      "source": "human",
      "verifiedBy": "seed-maintainer",
      "verifiedAt": "2026-06-21"
    },
    "entitlements": {
      "verdict": "partial",
      "confidence": 0.6,
      "standards": ["SCIM groups", "Team sync"],
      "summary": "Team/role sync via IdP groups (Team synchronization) on Enterprise; granular repo entitlements managed in-product.",
      "citations": [{ "title": "GitHub Docs", "url": "https://docs.github.com" }],
      "source": "seed"
    },
    "riskSignals": {
      "verdict": "unknown",
      "confidence": 0.4,
      "standards": [],
      "summary": "No documented CAEP/Shared Signals transmitter or receiver.",
      "citations": [],
      "source": "seed"
    },
    "logout": {
      "verdict": "partial",
      "confidence": 0.5,
      "standards": ["Session management"],
      "summary": "SSO session revocation and forced re-auth on Enterprise; no documented back-channel SLO.",
      "citations": [{ "title": "GitHub Docs", "url": "https://docs.github.com" }],
      "source": "seed"
    },
    "tokenRevocation": {
      "verdict": "supported",
      "confidence": 0.85,
      "standards": ["OAuth 2.0"],
      "summary": "OAuth app token revocation API and PAT/token management; secret-scanning revokes leaked tokens.",
      "citations": [{ "title": "GitHub REST API — OAuth authorizations", "url": "https://docs.github.com" }],
      "source": "human",
      "verifiedBy": "seed-maintainer",
      "verifiedAt": "2026-06-21"
    }
  }
}
