{
  "vendor": "Notion",
  "domain": "notion.so",
  "updatedAt": "2026-06-21",
  "controls": {
    "sso": {
      "verdict": "supported",
      "confidence": 0.75,
      "standards": ["SAML 2.0"],
      "summary": "SAML SSO available on the Enterprise plan ('SSO tax').",
      "citations": [{ "title": "Notion Help", "url": "https://www.notion.so/help" }, { "title": "The SSO Wall of Shame", "url": "https://sso.tax/" }],
      "source": "seed"
    },
    "ulm": {
      "verdict": "supported",
      "confidence": 0.7,
      "standards": ["SCIM 2.0"],
      "summary": "SCIM provisioning/deprovisioning on the Enterprise plan.",
      "citations": [{ "title": "Notion Help", "url": "https://www.notion.so/help" }],
      "source": "seed"
    },
    "entitlements": {
      "verdict": "partial",
      "confidence": 0.45,
      "standards": ["SCIM groups"],
      "summary": "Group provisioning via SCIM; teamspace permissions managed in-product.",
      "citations": [{ "title": "Notion Help", "url": "https://www.notion.so/help" }],
      "source": "seed"
    },
    "riskSignals": { "verdict": "unknown", "confidence": 0.3, "standards": [], "summary": "No documented CAEP/SSF support.", "citations": [], "source": "seed" },
    "logout": { "verdict": "unknown", "confidence": 0.3, "standards": [], "summary": "Session controls available on Enterprise; SLO not documented.", "citations": [], "source": "seed" },
    "tokenRevocation": { "verdict": "unknown", "confidence": 0.3, "standards": [], "summary": "OAuth integrations exist; token revocation flow not clearly documented.", "citations": [], "source": "seed" }
  }
}
